{
  "schemaVersion": "1.0",
  "projectId": "example-unity",
  "sourceSnapshotId": "example-only-not-created",
  "policyRef": "example-local-development",
  "tasks": [
    {
      "taskId": "door_logic",
      "goal": "Fix door state changes and add EditMode regression tests.",
      "dependsOn": [],
      "expectedPaths": ["Assets/Game/Doors/**", "Assets/Tests/EditMode/Doors/**"],
      "requiredCapabilities": ["source.edit", "unity.source.sync", "unity.tests.editmode"],
      "verification": { "requiredTests": [{ "mode": "EditMode", "filter": "Game.Tests.Doors" }] }
    },
    {
      "taskId": "hud_logic",
      "goal": "Fix HUD conditions and add EditMode regression tests.",
      "dependsOn": [],
      "expectedPaths": ["Assets/Game/Hud/**", "Assets/Tests/EditMode/Hud/**"],
      "requiredCapabilities": ["source.edit", "unity.source.sync", "unity.tests.editmode"],
      "verification": { "requiredTests": [{ "mode": "EditMode", "filter": "Game.Tests.Hud" }] }
    }
  ],
  "limits": { "maxWorkers": 2, "maxEditors": 2, "maxAttemptsPerTask": 2 },
  "completion": {
    "collectResults": true,
    "integration": "prepare-and-validate",
    "applyToOriginal": false,
    "releaseSuccessfulWorkspaces": true
  }
}
